{
  "frame_number": 220,
  "timestamp_seconds": 10.6,
  "lane_count": 3,
  "ego_lane_id": 2,
  "lane_boundaries": [
    {
      "boundary_id": 1,
      "points": [
        {
          "x": 0.12,
          "y": 0.95
        },
        {
          "x": 0.35,
          "y": 0.45
        }
      ],
      "confidence": 0.91
    },
    {
      "boundary_id": 2,
      "points": [
        {
          "x": 0.35,
          "y": 0.95
        },
        {
          "x": 0.5,
          "y": 0.45
        }
      ],
      "confidence": 0.92
    },
    {
      "boundary_id": 3,
      "points": [
        {
          "x": 0.67,
          "y": 0.95
        },
        {
          "x": 0.55,
          "y": 0.45
        }
      ],
      "confidence": 0.9
    },
    {
      "boundary_id": 4,
      "points": [
        {
          "x": 0.91,
          "y": 0.95
        },
        {
          "x": 0.7,
          "y": 0.45
        }
      ],
      "confidence": 0.88
    }
  ],
  "confidence": 0.89,
  "evidence": {
    "source": "road_geometry",
    "stable_lane_assignment": true
  }
}